{
  "$schema": "w-gpu0-device-linkage-catalog-1",
  "version": 1,
  "status": "experimental-not-source-backed-w",
  "identity": {
    "platform": "windows-x64",
    "provider": "cuda-driver",
    "device": "NVIDIA RTX A400",
    "computeCapability": "8.6",
    "target": "sm_86",
    "driverVersion": "581.42",
    "mlirVersion": "23.1.1",
    "clangVersion": "22.1.8",
    "recipe": "tooling/check-gpu0-cuda-windows.mjs",
    "recipeDigest": "sha256:4a44beee5b72487d3f3e0188e1c0dcd6f648461219037d08031a50c5cbf734ed",
    "adapterSourceDigest": "sha256:22e60f6318452135b5a00bd8acac3c3219449b877359660b1395eae5e4c53e76",
    "gpu0CoreDigest": "sha256:690b4b699f0fd74984fd7c62f5cc3316b0597899015bf3acf89b0b244c272ed1"
  },
  "correctness": {
    "expected": 42,
    "observed": 42
  },
  "protocol": {
    "clock": "QueryPerformanceCounter",
    "warmups": 101,
    "samples": 1001,
    "aggregation": "nearest-rank",
    "contextModuleAllocationOutsideTiming": true
  },
  "artifacts": [
    {
      "kind": "host-adapter",
      "sizeBytes": 14848,
      "digest": "sha256:9dfedd83e88aa74d7ab1be864ae15d20a4802bd5f010e5c78edca54c3a5acdfb"
    },
    {
      "kind": "device-mlir",
      "sizeBytes": 423,
      "digest": "sha256:af6483b71c9d9c1142acf7a97f363264d1494b4b1ca645b938d526ac157a74c4"
    },
    {
      "kind": "device-ptx",
      "sizeBytes": 502,
      "digest": "sha256:12b2dbd2a4b102a13fd7dba30c824b3640fcdce7a642ed23f1705d1642fd1c24"
    }
  ],
  "metrics": [
    {
      "id": "h2d",
      "unit": "ns",
      "p50": 2900,
      "p95": 14400
    },
    {
      "id": "dispatch-sync",
      "unit": "ns",
      "p50": 6900,
      "p95": 34000
    },
    {
      "id": "d2h",
      "unit": "ns",
      "p50": 7500,
      "p95": 17400
    },
    {
      "id": "end-to-end",
      "unit": "ns",
      "p50": 17500,
      "p95": 47100
    }
  ],
  "boundaries": {
    "sourceBackedW": false,
    "wRuntimeOrProvider": false,
    "homogeneousPinnedToolchain": false,
    "productRanking": false
  }
}
